{
  "scene_id": "scene_002",
  "source": {
    "task_id": "task_demo_001",
    "origin_video": "raw.mp4",
    "time_range": [12.4, 18.9]
  },
  "semantics": {
    "role": "hook",
    "language": "zh",
    "summary": "???????????????Mock-2?"
  },
  "assets": {
    "video": "video.mp4",
    "audio": "audio.wav",
    "subs": "subs.srt"
  }
}
